,Date,Title,category,Content,URL
64,"June 23, 2020",16 COVID-19 cases reported,Health & Community,"The Centre for Health Protection today announced it is investigating 16 additional confirmed cases of COVID-19, taking the number of confirmed cases in Hong Kong to 1,177.All of thenewly reported cases had a travel history during the incubation period. They include nine males and seven females aged between 11 and 48.The centre is also investigating an overseas case involving a 39-year-old woman who took Cathay Dragon flight KA734 in economy from India via Malaysia to Hong Kong on June 21.The patient was transferred directly from the airport upon arrival to United Christian Hospital.The centre has contacted health authorities in India to obtain more information about the patient.Itagain urged members of the public to maintain an appropriate social distance from other people to minimise the risk of infection.As the COVID-19 situation remains severe around the world, people are strongly urged to avoid non-essential travel outside Hong Kong.Additionally, the Hospital Authority reported that 89 confirmed COVID-19 patients are currently hospitalised and 1,083 confirmed and suspected patients have been discharged.For information and health advice on COVID-19, visit the Government’s dedicated webpage.",https://www.news.gov.hk/eng/2020/06/20200623/20200623_173120_556.html?type=category&name=health&tl=t
65,"June 24, 2020","GD, HK discuss easing travel",Health & Community,"Secretary for Food & Health Prof Sophia Chan said today the governments of Guangdong and Hong Kong are considering the launch of a pilot scheme to relax the cross-boundary flow of people between the two places within certain limits.Answering lawmakers’ questions in the Legislative Council today, Prof Chan said the COVID-19 outbreak in Guangdong Province has relatively subsided and the move wouldfacilitate people who need to travel between Guangdong and Hong Kong.She said the pilot scheme being discussed is expected to have restrictions on the number or coverage of people eligible for exemption in the initial phase.If there is a quota on the number of people, the two governments will consider a suitable mechanism for allocating the quota, such as through an open booking system.Furthermore, exempted people must not have left Hong Kong or Guangdong in the past 14 days preceding their departure.She noted that the two governments will mutually recognise the COVID-19 test results conducted by designated testing facilities which meet the standards.The mutual recognition will be done through the health code of the two places. The Hong Kong Special Administrative Region Government will develop a Hong Kong Health Code system, which enables the scheme participants’ virus test results in Hong Kong to be uploaded onto the code.Before leaving Hong Kong, eligible people with negative test results can connect to the electronic platform through a web browser using smartphones or mobile devices, and apply for the Hong Kong Health Code online and download it to their mobile phones or devices.To facilitate the mutual recognition of test results by Guangdong and Hong Kong boundary control officers, scheme participants can, of their own accord, choose to exchange the Hong Kong Health Code for use on Guangdong's Yuekang Code system for health declaration purposes when they enter the province.",https://www.news.gov.hk/eng/2020/06/20200624/20200624_162331_807.html?type=category&name=health&tl=t
66,"June 24, 2020",Festival showcases special melons,Health & Community,"The Agriculture, Fisheries & Conservation Department today introduced three unique varieties of organic watermelonsfor the Local Organic Watermelon Festival.The Hami Yellow Flesh melon, from Japan, is oblong and features a green skin with stripes and a yellowish and orange flesh.The spherical Super Sweet Black Angel 168 with its green striped skin and bright crimson-coloured flesh is a juicy melon from Australia, while the oblong Diana melon has an intense red flesh encased under a bright yellow striped skin and is remarkably sweet.The festival is being held at various farmers’ markets, which sell local organic watermelons as well as other seasonal farm produce.Click here for details.",https://www.news.gov.hk/eng/2020/06/20200624/20200624_175648_273.html?type=category&name=health&tl=t
67,"June 24, 2020",2 COVID-19 cases reported,Health & Community,"The Centre for Health Protection today said it is investigatingtwo additional confirmed COVID-19 cases, taking the number of confirmed cases in Hong Kong to 1,179.The newly reported cases involve one male and one female aged 55 and 47. They travelled during the incubation period.The centre again urged members of the public to maintain an appropriate social distance from other people to minimise the risk of infection.People should go out less and avoid social activities such as having meals out or other gatherings to minimise the risk of coronavirus clusters emerging in the community.As the COVID-19 situation remains severe and the number of cases reported around the world continues to rise, people are strongly urged to avoid all non-essential travel outside Hong Kong.Additionally, the Hospital Authority reported that 86 confirmed COVID-19 patients are currently hospitalised and 1,086 confirmed and suspected patients have been discharged.For information and health advice on COVID-19, visit the Government's dedicated webpage.",https://www.news.gov.hk/eng/2020/06/20200624/20200624_180312_472.html?type=category&name=health&tl=t
68,"June 25, 2020",Lab plays key role in virus fight,Health & Community,"Since the first confirmed case of COVID-19 in Hong Kong, the Enhanced Laboratory Surveillance Programme, which provides free COVID-19 testing, has been extended from public hospitals, private clinics and airport arrivals to bus drivers to minimise the risk of community transmission.Deep throat saliva specimens are sent to the Public Health Laboratory Services Branch in Shek Kip Mei every day for testing.Medical Technologist Anita Ng recalled that the first confirmed case was discovered on her birthday, making it an exciting but hectic day for her.“We diagnosed it at around 5pm. Everyone was in a panic. We had to ask for another sample and do a lot of re-testing to confirm it.”Round-the-clock testingDuring the peak of the epidemic in Hong Kong, the number of tests carried out could reach as many as 4,000 per day. The laboratory also deals with urgent testing requests such as for the 1,800 passengers on the World Dream Cruise in February and the Luk Chuen House residents who were evacuated from the Sha Tin housing block earlier this month.“We had to try our very best to finish everything within a day. We ate for 10 minutes and then continued to test,” Ms Ng added.The tests are not limited to human specimens. Multiple worshippers at a Buddhist temple in North Point were infected in February, so the Department of Health sent staff to collect environmental specimens from common areas as well as objects such as scriptures and kneeling blankets.“The number of viruses in environmental specimens is usually low. We have to test at least 10 times per specimen to ensure it is a true negative,” explained Ms Ng.Self-developed technologyAccording to Public Health Laboratory Services Branch Scientific Officer Peter Cheng, nucleic acid testing is the most accurate testing method to identify COVID-19 to date.Upon arrival at the laboratory, the specimens undergo pre-analytical treatment. The technologists then extract the nucleic acid from the specimens and add master mix reagents for polymerase chain reaction (PCR) amplification. Fluorescent signals can be detected during the process for the presence of the virus.Mr Cheng designed the primers and probes required for the test. The technology was approved by the Hong Kong Laboratory Accreditation Scheme.“The sensitivity is almost 100%. Even if there are only 200 copies of the virus per millilitre they can be detected. The specificity is also up to 100%. That means we do not have any problem of false positives or false negatives,” he said.As of June 16, more than 300,000 samples had been tested by the Public Health Laboratory Services Branch and the Hospital Authority.To advance the identification of COVID-19 infected patients, the Enhanced Laboratory Surveillance Programme was further extended to cover bus drivers last week.",https://www.news.gov.hk/eng/2020/06/20200623/20200623_201658_608.html?type=category&name=health&tl=t
69,"June 25, 2020",Govt maintains support in virus fight,Health & Community,"Chief Executive Carrie Lam“Food is heaven to the people.” This well-known Chinese saying is particularly true in the case of Hong Kong which is a food paradise. The recent Father’s Day was the first Sunday after the Hong Kong Special Administrative Region Government lifted most social distancing measures affecting catering businesses. We were pleased to see that people went to restaurants to celebrate the day with family and friends, while restaurant owners and workers were much encouraged by the increase in business. Just asthe Honourable Tommy Cheung, the Legislative Council Member representing the catering sector said, it is hoped that catering businesses will employ more workers so that the unemployment rate of the catering industry can return to single digits.The above phenomenon illustrates how the suppress and lift strategy adopted by the Government to prevent and control the epidemic is applied when Hong Kong’s epidemic situation has stabilised. Our city has entered a new phase of relaxing restrictions while keeping public health risks in check. Economic activities of all sorts have gradually resumed and people’s lives have generally returned to normal. However, lifting those restrictions does not mean letting our guard down. Before the advent and widespread application of effective vaccines, we still have to stay alert and be well-prepared to make prompt responses whenever necessary.Developments of the epidemicHong Kong’s epidemic situation has remained stable with a total of 114 confirmed cases reported over the past month (from May 25 to June 24). Among them, 102 were imported cases, involving Hong Kong residents returning from overseas with the largest number from Pakistan, the Philippines, India and Bangladesh or their close contacts. All cases were detected because of the testing of inbound travellers from overseas. Since we have adopted a test and hold strategy, ie inbound travellers can only leave a designated location after receiving the virus test result, the chance of the virus spreading into the community has been minimised.However, during the period, the emergence of a local cluster of 12 confirmed cases, the source of which remains unknown, has caused considerable concerns. These 12 cases involved the family members, colleagues and residents living in the same housing block of the first confirmed patient. It was also the first time in Hong Kong that an ambulance officer was suspected of contracting the virus in the course of transporting an infected person to hospital. We were highly concerned as the scope of infection was rather broad. Staff and experts from the Centre for Health Protection (CHP) and relevant departments went to the scene immediately to conduct an inspection, trace contacts, carry out large-scale virus testing for high-risk people (including residents living in the same housing block, colleagues of the confirmed patients, etc), as well as to step up cleaning of facilities.As five confirmed patients were found to be living in the same units on different floors of the same block, for the sake of prudence, we evacuated 24 households living in those units to quarantine centres. In this cluster, the first case was confirmed on May 31 while the last one was confirmed on June 13. Much to our relief, no more infections have since been detected. Unfortunately, two elderly residents who were infected passed away recently to become the fifth and sixth COVID-19 deaths in Hong Kong. I would like to express my sincere condolences to their families.The intermittent emergence of local infection clusters reminds us once again of the presence of undetected infections in the community. It is imperative for the Government to step up virus testing to keep the epidemic in check through early identification, early isolation and early treatment.Anti-epidemic effortsAs the local epidemic situation has remained generally stable, following the direction we started to take last month, we have continued to relax anti-epidemic measures in a moderate and phased manner. On social distancing, K3 to S5 students have all resumed classes; public facilities and business premises (including the two theme parks) previously closed have been allowed to reopen subject to fulfilment of infection control requirements; the number of persons allowed in group gatherings in public places has also been relaxed fromeight to 50. With a weak economy and a rising unemployment rate, such relaxations are timely; they also help meet people’s aspiration to resume social life.As recommended by our experts, we have been stepping up virus testing to ascertain the presence of the virus in the community. In the first half of June, an average of 4,000 virus tests a day were conducted by public institutions, an increase of over 60% compared with May. Our short-term target is to enhance the testing capacity of public institutions to 7,000 virus tests a day. With the introduction of a “health code” to be used for travelling between Guangdong, Hong Kong and Macau, and a “travel bubble” to be set up with specific overseas countries, people’s demand for virus testing will increase significantly. The Department of Health (DH) is liaising with private institutions to help them enhance their testing capacity. Major measures implemented by the Government in response to developments over the past month are set out below:DateEventMay 26The Government announced that four types of business premises previously closed, including karaoke establishments, clubs or nightclubs, bathhouses and party rooms, could resume operation from May 29, subject to fulfilment of certain preventive measures, and transfer/transit services at Hong Kong International Airport would resume starting from June 1.May 26The Leisure & Cultural Services Department (LCSD) announced that its performance venues would be reopened from June 1 and all Music Office music centres would reopen for full service on the same day.May 27S3 to S5 students resumed classes.June 1The CHP under the DH issued a letter to all private doctors to remind them to arrange virus tests for patients with respiratory symptoms or other symptoms, even if the symptoms were mild.June 2In view of the emergence of new local cases, the Government announced that the existing disease prevention regulations and restrictions on catering premises and scheduled premises would be maintained and group gatherings of more than eight persons in public places would continue to be prohibited till June 18. The expiry date of the legislation on compulsory quarantine arrangements applicable to inbound travellers from the Mainland, Macau, Taiwan and overseas would be extended.June 8P4 to S2 students resumed classes.June 10The LCSD announced that more public swimming pools, gazetted beaches, libraries and museums would be reopened. The arrangement of opening alternate courts/tables of badminton courts, billiard/American pool rooms and table tennis rooms would be relaxed and booking applications for some land recreation and sports facilities and wedding venues would resume.June 15K3 to P3 and S3 to S5 cross-boundary students resumed classes. Arrangements would be made for cross-boundary students to take school buses to travel directly between the boundary control points and schools.June 16The Government announced that some social distancing measures would be relaxed from June 19 for a period of 14 days till July 2. The relaxation measures would include the following: the number of persons allowed in group gatherings in public places would be relaxed from eight to 50; list of exempted group gatherings would be expanded to include catering business premises subject to relevant infection prevention measures and restrictions; social distancing measures at catering business premises and scheduled premises would be relaxed, ie the limit on the number of persons allowed to be seated together at one table at catering business premises would be removed; the number of persons allowed to be seated together at one table in bars/pubs would be increased fromfour to eight persons; the limit on the number of persons at each facility/group/room at scheduled premises would be increased from eight to 16 persons; live performances and dancing activities would be allowed to resume subject to relevant infection control measures.June 17The LCSD announced that more leisure and cultural facilities and venues, including pitches and children facilities would reopen.June 18In view of the latest COVID-19 situation in Beijing, the Government announced that all inbound travellers arriving at Hong Kong International Airport from Beijing would be required to wait for test results at a designated location after submitting their deep throat saliva samples for virus testing and would be subject to compulsory home quarantine for 14 days should they test negative.Furthermore, the Government arranged several special flights in the past month to bring home over 900 Hong Kong residents stranded in India and Nepal.Striking the right balanceWe are fully prepared to fight an enduring battle against the virus and will continue to adopt the suppress and lift strategy to strive for the right balance. I once used the description “three-way tug-of-war” to illustrate the need to consider the three factors of public health, economic impact and social acceptance when making adjustments to our control measures. Striking the right balance is not an exact science and is easier said than done. We have to consider various factors and then act decisively. That said, let me make it clear again that political considerations absolutely play no part in such assessments. Therefore, the allegation that prohibiting group gatherings of over 50 persons involves consideration of suppressing protests and demonstrations is totally groundless. As a matter of fact, a variety of large scale activities, including ball games, open concerts, and even the annual dragon boat races, etc are affected by the same restriction.Anti-epidemic suppliesTo help our people to better fight this enduring battle, we arranged for free reusable masks, ie CuMask, to be provided for each Hong Kong citizen. The response was positive with a total of over 1.44million registrations received during the one-month registration period, covering more than 3.93 million people. The masks have been delivered to recipients by Hongkong Post. The Government has also directly delivered the CuMask to schools, residential homes and social welfare institutions for use by relevant individuals.In addition, from next week, a pack of 10 disposable masks will be distributed to each residential address in Hong Kong. These masks are the first batch of masks procured by the Government under the Local Mask Production Subsidy Scheme. We would like to share these masks with our people as part of our collective fight against the virus.Appealing for stability in Hong KongBattling this epidemic, I hope that people will cherish even more the hard-earned stable epidemic situation which has allowed us to revive our economy and improve local employment. In the same way, Hong Kong cannot stand chaos. Activities such as vandalism, advocating Hong Kong independence, illegal possession of explosives and firearms, etc have clearly threatened national security. The enactment of legislation for safeguarding national security in the Hong Kong SAR by the central authorities at the state level is to plug the loophole in our legal system and enforcement mechanisms so as to restore stability to our society as soon as possible and better protect national security. It is the constitutional responsibility of the Hong Kong SAR to safeguard national security, and also the common obligation of nationals of the entire country, including Hong Kong people.Chief Executive Carrie Lam issued thisarticle entitled Resuming Activities after Fighting the Virus for Five Months on June 25.",https://www.news.gov.hk/eng/2020/06/20200625/20200625_154951_295.html?type=category&name=health&tl=t
70,"June 25, 2020",HK reports 7th COVID-19 death,Health & Community,"Princess Margaret Hospital (PMH) announced that a 55-year-old male COVID-19 patient passed away this morning, taking the number of COVID-19 patients who have passed away in public hospitals to seven.The patient (case no. 1180) had suffereda stroke while in the Philippines and was admitted to a local hospital at the end of May.He was escorted back to Hong Kong by air ambulance and admitted to PMH on June 23. He had a high fever on admission and was in a serious condition. He subsequentlytested positive for the coronavirus.The patient's condition later deteriorated and he developed severe sepsis. Heeventually succumbed to the disease at 1.30 this morning.The case has been referred to the coroner for follow-up.",https://www.news.gov.hk/eng/2020/06/20200625/20200625_133110_982.html?type=category&name=health&tl=t
71,"June 25, 2020",CSSA max rent allowance to rise,Health & Community,"The maximum rent allowance under the Comprehensive Social Security Assistance (CSSA) Scheme will be increased from July 1, the Social Welfare Department announced today.A single beneficiary can receive up to $2,475 per month in rent allowance, compared to the current maximum level of $1,945.Families underthe scheme can receive a maximum of$4,370 to $7,675 per month, up from the current$3,915 to $6,820.Additionally, the income limits for the Old Age Living Allowance (OALA) under the Social Security Allowance Scheme, including the OALA under the Guangdong and Fujian schemes, will also be increased on the same day.Applicants and recipients may call 2343 2255 or contact their social security field units for enquiries.Clickhere for the adjustment details.",https://www.news.gov.hk/eng/2020/06/20200625/20200625_140759_400.html?type=category&name=health&tl=t
72,"June 25, 2020",30m free masks to be delivered,Health & Community,"The Government willdeliver 30 million masks for free to all residential addresses in the city throughHongkong Post starting June 30.The Commerce & Economic Development Bureau today said each household will receive a pack of 10 disposable adult masks which are the first batch procured by the Government under the Local Mask Production Subsidy Scheme.The Government wishes to share these masks with the public and fight the virus together.About 2.88 million residential addresses are covered by the Hongkong Post delivery service. To make the delivery process simple for citizens, there is no need for any pre-registration.The postman will directly insert a pack of 10 masks, measuring 230mm by 135mm, into an adequately-sized residential letter box, and attempt door delivery if the pack cannot fit through.If no one is home, the postman will leave a notification card for the residents to collect the pack of masks at a designated post office within 28 working days.As for the small number of residential households not covered by the Hongkong Post service, assistance from the Social Welfare Department and District Offices will be sought to make alternative delivery arrangements.Hongkong Post will complete the distribution exercisein about three weeks.Enquiries can be made to the dedicated hotline 183 6136 or viaemail starting from 9am tomorrow.The Government estimates that when all 20 subsidised lines under the scheme are in full production, about 34 million masks will be supplied to iteach month,with another 7.6 million to the local market.",https://www.news.gov.hk/eng/2020/06/20200625/20200625_171153_435.html?type=category&name=health&tl=t
73,"June 25, 2020",14 COVID-19 cases reported,Health & Community,"The Centre for Health Protection today said it is investigating14 additional confirmed COVID-19 cases, taking the number of confirmed cases in Hong Kong to 1,193.The cases involve nine males and five females aged betweentwo and 39. All of them had travelled during the incubation period.The centre again urged members of the public to maintain an appropriate social distance from other people to minimise the risk of infection.People should go out less and avoid social activities such as having meals out or other gatherings to minimise the risk of coronavirus clusters emerging in the community.As the COVID-19 situation remains severe and the number of cases reported around the world continues to rise, people are strongly urged to avoid all non-essential travel outside Hong Kong as well as maintain strict personal and environmental hygiene at all times.Additionally, the Hospital Authority reported that 85 confirmed COVID-19 patients are currently hospitalised and 1,088 confirmed and suspected patients have been discharged.For information and health advice on COVID-19, visit the Government's dedicated webpage.",https://www.news.gov.hk/eng/2020/06/20200625/20200625_183153_513.html?type=category&name=health&tl=t
